{
 "version": "0.1",
 "scenario_id": "example_flood",
 "seeds": [
  1,
  2,
  3
 ],
 "perturbation_ranges": {
  "travel_time_mult": [
   0.8,
   1.6
  ],
  "endurance_scale": [
   0.7,
   1.3
  ],
  "storage_scale": [
   0.7,
   1.3
  ],
  "inflow_scale": [
   0.85,
   1.15
  ]
 },
 "plans": {
  "baseline": {
   "planner": "baseline",
   "assignments": 39,
   "rule": "alerts in arrival order"
  },
  "ember": {
   "planner": "ember",
   "assignments": 35,
   "versions": [
    {
     "version": 1,
     "t_s": 0.0,
     "trigger": "initial plan",
     "changes": 0,
     "wall_s": 0.758
    },
    {
     "version": 2,
     "t_s": 1800.0,
     "trigger": "scenario report: need for household #864",
     "changes": 4,
     "wall_s": 0.458
    },
    {
     "version": 3,
     "t_s": 2700.0,
     "trigger": "scenario report: need for household #2808",
     "changes": 0,
     "wall_s": 0.455
    },
    {
     "version": 4,
     "t_s": 6000.0,
     "trigger": "scenario report: facility_status for mt_auburn",
     "changes": 0,
     "wall_s": 0.407
    }
   ]
  }
 },
 "nominal": {
  "baseline": {
   "projected": true,
   "people_reached_before_deadline": 11,
   "people_unreached": 39,
   "unresolved_needs": 2,
   "hospital_outage_s": 0.0,
   "service_outage_s_total": 5400.0,
   "overflow_m3": 2000.0,
   "fuel_l": 6.68,
   "vehicle_km": 38.49,
   "infeasible_assignments": 0,
   "reserve_remaining": 2,
   "replan_latency_s": null
  },
  "ember": {
   "projected": true,
   "people_reached_before_deadline": 48,
   "people_unreached": 8,
   "unresolved_needs": 6,
   "hospital_outage_s": 0.0,
   "service_outage_s_total": 0.0,
   "overflow_m3": 0.0,
   "fuel_l": 16.3,
   "vehicle_km": 82.49,
   "infeasible_assignments": 0,
   "reserve_remaining": 2,
   "replan_latency_s": null
  }
 },
 "per_seed": [
  {
   "seed": 1,
   "perturbation": {
    "travel_time_mult": 0.907,
    "endurance_scale": 1.208,
    "storage_scale": 1.158,
    "inflow_scale": 0.927
   },
   "baseline": {
    "projected": true,
    "people_reached_before_deadline": 11,
    "people_unreached": 39,
    "unresolved_needs": 2,
    "hospital_outage_s": 0.0,
    "service_outage_s_total": 5400.0,
    "overflow_m3": 930.0,
    "fuel_l": 6.68,
    "vehicle_km": 38.49,
    "infeasible_assignments": 0,
    "reserve_remaining": 2,
    "replan_latency_s": null
   },
   "ember": {
    "projected": true,
    "people_reached_before_deadline": 48,
    "people_unreached": 8,
    "unresolved_needs": 6,
    "hospital_outage_s": 0.0,
    "service_outage_s_total": 0.0,
    "overflow_m3": 0.0,
    "fuel_l": 16.33,
    "vehicle_km": 82.6,
    "infeasible_assignments": 0,
    "reserve_remaining": 2,
    "replan_latency_s": null
   }
  },
  {
   "seed": 2,
   "perturbation": {
    "travel_time_mult": 1.565,
    "endurance_scale": 1.269,
    "storage_scale": 0.734,
    "inflow_scale": 0.875
   },
   "baseline": {
    "projected": true,
    "people_reached_before_deadline": 11,
    "people_unreached": 39,
    "unresolved_needs": 2,
    "hospital_outage_s": 0.0,
    "service_outage_s_total": 5400.0,
    "overflow_m3": 2314.0,
    "fuel_l": 5.66,
    "vehicle_km": 32.41,
    "infeasible_assignments": 0,
    "reserve_remaining": 2,
    "replan_latency_s": null
   },
   "ember": {
    "projected": true,
    "people_reached_before_deadline": 33,
    "people_unreached": 18,
    "unresolved_needs": 6,
    "hospital_outage_s": 0.0,
    "service_outage_s_total": 0.0,
    "overflow_m3": 0.0,
    "fuel_l": 13.45,
    "vehicle_km": 67.21,
    "infeasible_assignments": 0,
    "reserve_remaining": 2,
    "replan_latency_s": null
   }
  },
  {
   "seed": 3,
   "perturbation": {
    "travel_time_mult": 0.99,
    "endurance_scale": 1.027,
    "storage_scale": 0.922,
    "inflow_scale": 1.031
   },
   "baseline": {
    "projected": true,
    "people_reached_before_deadline": 11,
    "people_unreached": 39,
    "unresolved_needs": 2,
    "hospital_outage_s": 0.0,
    "service_outage_s_total": 5400.0,
    "overflow_m3": 2498.0,
    "fuel_l": 6.68,
    "vehicle_km": 38.49,
    "infeasible_assignments": 0,
    "reserve_remaining": 2,
    "replan_latency_s": null
   },
   "ember": {
    "projected": true,
    "people_reached_before_deadline": 48,
    "people_unreached": 8,
    "unresolved_needs": 6,
    "hospital_outage_s": 0.0,
    "service_outage_s_total": 0.0,
    "overflow_m3": 0.0,
    "fuel_l": 16.3,
    "vehicle_km": 82.49,
    "infeasible_assignments": 0,
    "reserve_remaining": 2,
    "replan_latency_s": null
   }
  }
 ],
 "metrics": [
  {
   "metric": "people_reached_before_deadline",
   "label": "people reached before their deadline",
   "better": "higher",
   "unit": "people",
   "baseline_mean": 11.0,
   "ember_mean": 43.0,
   "diff_mean": 32.0,
   "diff_min": 22,
   "diff_max": 37,
   "ember_better_seeds": 3,
   "ember_worse_seeds": 0,
   "ties": 0,
   "sentence": "People reached before their deadline: EMBER 43 people vs baseline 11 people (+32 people on average; range +22 to +37 people across seeds). EMBER is better: better on 3/3 seeds, worse on 0."
  },
  {
   "metric": "people_unreached",
   "label": "people not reached before their deadline",
   "better": "lower",
   "unit": "people",
   "baseline_mean": 39.0,
   "ember_mean": 11.333,
   "diff_mean": -27.667,
   "diff_min": -31,
   "diff_max": -21,
   "ember_better_seeds": 3,
   "ember_worse_seeds": 0,
   "ties": 0,
   "sentence": "People not reached before their deadline: EMBER 11.3 people vs baseline 39 people (\u221227.7 people on average; range \u221231 to \u221221 people across seeds). EMBER is better: better on 3/3 seeds, worse on 0."
  },
  {
   "metric": "hospital_outage_s",
   "label": "hospital outage",
   "better": "lower",
   "unit": "s",
   "baseline_mean": 0.0,
   "ember_mean": 0.0,
   "diff_mean": 0.0,
   "diff_min": 0.0,
   "diff_max": 0.0,
   "ember_better_seeds": 0,
   "ember_worse_seeds": 0,
   "ties": 3,
   "sentence": "Hospital outage: no difference (0 min for both) on all 3 seeds."
  },
  {
   "metric": "service_outage_s_total",
   "label": "critical-service outage",
   "better": "lower",
   "unit": "s",
   "baseline_mean": 5400.0,
   "ember_mean": 0.0,
   "diff_mean": -5400.0,
   "diff_min": -5400.0,
   "diff_max": -5400.0,
   "ember_better_seeds": 3,
   "ember_worse_seeds": 0,
   "ties": 0,
   "sentence": "Critical-service outage: EMBER 0 min vs baseline 90 min (\u221290 min on average; range \u221290 to \u221290 min across seeds). EMBER is better: better on 3/3 seeds, worse on 0."
  },
  {
   "metric": "overflow_m3",
   "label": "untreated wastewater overflow to the Charles",
   "better": "lower",
   "unit": "m\u00b3",
   "baseline_mean": 1914.0,
   "ember_mean": 0.0,
   "diff_mean": -1914.0,
   "diff_min": -2498.0,
   "diff_max": -930.0,
   "ember_better_seeds": 3,
   "ember_worse_seeds": 0,
   "ties": 0,
   "sentence": "Untreated wastewater overflow to the Charles: EMBER 0 m\u00b3 vs baseline 1,914 m\u00b3 (\u22121,914 m\u00b3 on average; range \u22122,498 to \u2212930 m\u00b3 across seeds). EMBER is better: better on 3/3 seeds, worse on 0."
  },
  {
   "metric": "unresolved_needs",
   "label": "unresolved needs",
   "better": "lower",
   "unit": "needs",
   "baseline_mean": 2.0,
   "ember_mean": 6.0,
   "diff_mean": 4.0,
   "diff_min": 4,
   "diff_max": 4,
   "ember_better_seeds": 0,
   "ember_worse_seeds": 3,
   "ties": 0,
   "sentence": "Unresolved needs: EMBER 6 needs vs baseline 2 needs (+4 needs on average; range +4 to +4 needs across seeds). EMBER is worse: better on 0/3 seeds, worse on 3."
  },
  {
   "metric": "infeasible_assignments",
   "label": "infeasible assignments",
   "better": "lower",
   "unit": "assignments",
   "baseline_mean": 0.0,
   "ember_mean": 0.0,
   "diff_mean": 0.0,
   "diff_min": 0,
   "diff_max": 0,
   "ember_better_seeds": 0,
   "ember_worse_seeds": 0,
   "ties": 3,
   "sentence": "Infeasible assignments: no difference (0 assignments for both) on all 3 seeds."
  },
  {
   "metric": "vehicle_km",
   "label": "vehicle-km driven",
   "better": "lower",
   "unit": "km",
   "baseline_mean": 36.463,
   "ember_mean": 77.433,
   "diff_mean": 40.97,
   "diff_min": 34.8,
   "diff_max": 44.11,
   "ember_better_seeds": 0,
   "ember_worse_seeds": 3,
   "ties": 0,
   "sentence": "Vehicle-km driven: EMBER 77.4 km vs baseline 36.5 km (+41 km on average; range +34.8 to +44.1 km across seeds). EMBER is worse: better on 0/3 seeds, worse on 3."
  },
  {
   "metric": "fuel_l",
   "label": "fuel used",
   "better": "lower",
   "unit": "l",
   "baseline_mean": 6.34,
   "ember_mean": 15.36,
   "diff_mean": 9.02,
   "diff_min": 7.79,
   "diff_max": 9.65,
   "ember_better_seeds": 0,
   "ember_worse_seeds": 3,
   "ties": 0,
   "sentence": "Fuel used: EMBER 15.4 l vs baseline 6.3 l (+9 l on average; range +7.8 to +9.6 l across seeds). EMBER is worse: better on 0/3 seeds, worse on 3."
  },
  {
   "metric": "reserve_remaining",
   "label": "resources left in reserve",
   "better": "higher",
   "unit": "resources",
   "baseline_mean": 2.0,
   "ember_mean": 2.0,
   "diff_mean": 0.0,
   "diff_min": 0,
   "diff_max": 0,
   "ember_better_seeds": 0,
   "ember_worse_seeds": 0,
   "ties": 3,
   "sentence": "Resources left in reserve: no difference (2 resources for both) on all 3 seeds."
  }
 ],
 "headline": [
  "People reached before their deadline: EMBER 43 people vs baseline 11 people (+32 people on average; range +22 to +37 people across seeds). EMBER is better: better on 3/3 seeds, worse on 0.",
  "People not reached before their deadline: EMBER 11.3 people vs baseline 39 people (\u221227.7 people on average; range \u221231 to \u221221 people across seeds). EMBER is better: better on 3/3 seeds, worse on 0.",
  "Untreated wastewater overflow to the Charles: EMBER 0 m\u00b3 vs baseline 1,914 m\u00b3 (\u22121,914 m\u00b3 on average; range \u22122,498 to \u2212930 m\u00b3 across seeds). EMBER is better: better on 3/3 seeds, worse on 0.",